{
  "artifacts": [],
  "check_declarations_hash": "E15B5324C6969763A142C862FB6D9A47D81082C480181DFB45BF794517263019",
  "checks": [
    {
      "args": [
        "scripts/run_checks.py"
      ],
      "check_id": "check:generated-current",
      "command": "python",
      "covers_obligation_ids": [
        "obligation:generated-current-check"
      ],
      "cwd_token": "repository_root",
      "depends_on_check_ids": [],
      "evidence_class": "hard",
      "evidence_domain_id": "generated_skill_current",
      "evidence_subject_id": "subject:good_single_skill:generated-current",
      "execution_owner_id": "owner:good_single_skill",
      "expected": {
        "exit_code": 0
      },
      "input_component_ids": [
        "component:documentation_model:1d129ebff5097d21",
        "component:runtime_source:161d0a7bad2896b8"
      ],
      "input_selectors": [
        {
          "kind": "path",
          "path": "SKILL.md"
        },
        {
          "kind": "path",
          "path": "scripts/run_checks.py"
        }
      ],
      "kind": "command",
      "maintenance_unit_id": "unit:good_single_skill",
      "member_skill_id": "good_single_skill",
      "owner_declaration_hash": "sha256:3bb1c4e183615a91680fe0868ba75f1c06f0272eb41f7e157ae670a3a8f5035d",
      "owner_input_projection_hash": "sha256:3db28f6614f9b6cab0dc19c6b1fe6b899b5a46871563e6517cc9ec62818522ff",
      "projection_declaration_hash": "sha256:5b2bf07eefedd158c5877664519b76d3e798b9b94196f078b683a611107f3381",
      "semantic_check_id": "semantic:good_single_skill:generated-current",
      "target_input_role_ids": [],
      "timeout_seconds": 30
    }
  ],
  "claim_boundary": "This generated binding proves only deterministic current contract structure. It does not prove target execution, semantic acceptance, installation, or release.",
  "closure_profiles": [
    {
      "profile_id": "enforced",
      "required_obligation_ids": [
        "obligation:generated-current-check"
      ]
    }
  ],
  "compiler_version": "skillguard.contract_compiler.v2",
  "consumer_projection": {
    "prohibited_path_prefixes": [
      ".skillguard/"
    ],
    "prohibited_prompt_tokens": [
      "SkillGuard",
      ".skillguard",
      "skillguard.py"
    ],
    "projection_id": "projection:consumer-distribution",
    "release_manifest_path": "consumer-release.json"
  },
  "content_impact_plan": {
    "all_owner_component_ids": [
      "component:documentation_model:1d129ebff5097d21",
      "component:runtime_source:161d0a7bad2896b8"
    ],
    "check_projections": [
      {
        "check_id": "check:generated-current",
        "covers_obligation_ids": [
          "obligation:generated-current-check"
        ],
        "evidence_class": "hard",
        "evidence_domain_id": "generated_skill_current",
        "execution_owner_id": "owner:good_single_skill",
        "projection_declaration_hash": "sha256:5b2bf07eefedd158c5877664519b76d3e798b9b94196f078b683a611107f3381",
        "semantic_check_id": "semantic:good_single_skill:generated-current"
      }
    ],
    "components": [
      {
        "classification_rule_ids": [
          "skillguard.content_role_classifier.current:contract_schema"
        ],
        "component_hash": "sha256:3832b1554a6df97dd9582d3b2f67bbf17b562a31af7220ac460174daecdeb300",
        "component_id": "component:contract_schema:ce9e35077dbf6df6",
        "consumer_ids": [
          "projection:contract-compile",
          "projection:source-maintenance"
        ],
        "install_disposition": "source_only",
        "member_paths": [
          ".skillguard/contract-source.json"
        ],
        "role": "contract_schema"
      },
      {
        "classification_rule_ids": [
          "skillguard.content_role_classifier.current:documentation_model"
        ],
        "component_hash": "sha256:0aee74871ec8934916eacbde08fadb940e7088a6bebbbc48fa40bfdd879dbe77",
        "component_id": "component:documentation_model:1d129ebff5097d21",
        "consumer_ids": [
          "owner:good_single_skill",
          "projection:installation"
        ],
        "install_disposition": "copy",
        "member_paths": [
          "SKILL.md"
        ],
        "role": "documentation_model"
      },
      {
        "classification_rule_ids": [
          "skillguard.content_role_classifier.current:documentation_model"
        ],
        "component_hash": "sha256:0850f114b6f40233c388fdcdf1184a93265e842fc441f4109d0bbbf46c9e687b",
        "component_id": "component:documentation_model:cc36a95fe48682bf",
        "consumer_ids": [
          "projection:contract-compile",
          "projection:installation"
        ],
        "install_disposition": "copy",
        "member_paths": [
          ".skillguard/flowguard_contract_model.py"
        ],
        "role": "documentation_model"
      },
      {
        "classification_rule_ids": [
          "skillguard.content_role_classifier.current:runtime_source"
        ],
        "component_hash": "sha256:a252bf6e001cfb1d57246975efda264caa994797261c11897325e1f62eef7a65",
        "component_id": "component:runtime_source:161d0a7bad2896b8",
        "consumer_ids": [
          "owner:good_single_skill",
          "projection:installation"
        ],
        "install_disposition": "copy",
        "member_paths": [
          "scripts/run_checks.py"
        ],
        "role": "runtime_source"
      }
    ],
    "full_admission_reason_codes": [
      "explicit_final_gate",
      "explicit_release_gate",
      "impact_policy_or_compiler_changed",
      "shared_validation_runtime_changed",
      "all_owner_component_changed"
    ],
    "health": {
      "ambiguous_role_paths": [],
      "dependency_parse_errors": [],
      "duplicate_owner_ids": [],
      "invalid_dependency_edges": [],
      "owner_cycles": [],
      "unmapped_paths": []
    },
    "impact_graph_hash": "sha256:447f68f7fc108b41d211c3634898d4c0c6b6614b4ce28ed56c5509bcecec7ec7",
    "inventory": [
      {
        "classification_rule_id": "skillguard.content_role_classifier.current:contract_schema",
        "content_hash": "sha256:b955a64a7d5772da4d428656847de8178d7e3d2923fe9ffe97b080b4bb5d2ad6",
        "install_disposition": "source_only",
        "path": ".skillguard/contract-source.json",
        "role": "contract_schema"
      },
      {
        "classification_rule_id": "skillguard.content_role_classifier.current:documentation_model",
        "content_hash": "sha256:c24c426e3d4577aa2b4fe81a9728a765d8aa8f1785f3ffd27115e750829ebee4",
        "install_disposition": "copy",
        "path": ".skillguard/flowguard_contract_model.py",
        "role": "documentation_model"
      },
      {
        "classification_rule_id": "skillguard.content_role_classifier.current:documentation_model",
        "content_hash": "sha256:9a0475027bde2bc66d00cd0d2eecf97ccff75d78a7ce4ddaeac494f316211ae2",
        "install_disposition": "copy",
        "path": "SKILL.md",
        "role": "documentation_model"
      },
      {
        "classification_rule_id": "skillguard.content_role_classifier.current:runtime_source",
        "content_hash": "sha256:3f79a39b42462886b1f9d25a3a8a4ebf30fe0029eda892855737dee93c3128e7",
        "install_disposition": "copy",
        "path": "scripts/run_checks.py",
        "role": "runtime_source"
      }
    ],
    "inventory_hash": "sha256:ba9b719f527bb7a399014e0be48055377ed28cca7fd6cf2693bffbb0cac594e3",
    "member_root_path": ".",
    "owner_receipt_root_ref": {
      "path_token": "owner_evidence_root",
      "relative_path": "check-executions"
    },
    "owners": [
      {
        "check_ids": [
          "check:generated-current"
        ],
        "depends_on_owner_ids": [],
        "execution_owner_id": "owner:good_single_skill",
        "input_component_ids": [
          "component:documentation_model:1d129ebff5097d21",
          "component:runtime_source:161d0a7bad2896b8"
        ],
        "input_selectors": [
          {
            "kind": "path",
            "path": "SKILL.md"
          },
          {
            "kind": "path",
            "path": "scripts/run_checks.py"
          }
        ],
        "owner_declaration_hash": "sha256:3bb1c4e183615a91680fe0868ba75f1c06f0272eb41f7e157ae670a3a8f5035d",
        "owner_input_projection_hash": "sha256:3db28f6614f9b6cab0dc19c6b1fe6b899b5a46871563e6517cc9ec62818522ff",
        "target_input_role_ids": []
      }
    ],
    "policy_id": "skillguard.content_impact_policy.current",
    "portfolio_target_edges": [],
    "projection_consumers": [
      {
        "consumer_id": "projection:contract-compile",
        "consumer_projection_hash": "sha256:1ec4d3f3f8fbd7c12a21ecaf134ccd0509c2fd8a819699e2eb6f300a56d8d723",
        "impact_plan_schema_version": "skillguard.content_impact_plan.current",
        "impact_policy_id": "skillguard.content_impact_policy.current",
        "input_component_ids": [
          "component:contract_schema:ce9e35077dbf6df6",
          "component:documentation_model:cc36a95fe48682bf"
        ],
        "input_projection_hash": "sha256:69e60c5770cac1d0e4f53db9ac6f753f64b4d40d4ed0e5cfafd8b6671212d337",
        "kind": "contract_compile",
        "projection_declaration_hash": "sha256:24820feb5d4914ba5339b8defe05f6adc54ecc667da013e27b0cd88715175e34"
      },
      {
        "consumer_id": "projection:global-router",
        "consumer_projection_hash": "sha256:c05984df180fa719bed1a62a48db6052b1a7e03b87e7a9e6eda3430a1905cf86",
        "impact_plan_schema_version": "skillguard.content_impact_plan.current",
        "impact_policy_id": "skillguard.content_impact_policy.current",
        "input_component_ids": [],
        "input_projection_hash": "sha256:37517e5f3dc66819f61f5a7bb8ace1921282415f10551d2defa5c3eb0985b570",
        "kind": "global_router",
        "projection_declaration_hash": "sha256:667973c38b6c505040402a17baf7ebb4fb1ebe562415b046f317c029a3861f2a"
      },
      {
        "consumer_id": "projection:installation",